{
  "schema_version": 1,
  "session_id": "5027aee9-c6e4-41de-8625-7ea0869a3307",
  "job_id": "2f746e31-d62a-4e1c-a919-3f88ecde31c2",
  "state": "completed",
  "created_at": "2026-07-31T08:00:00Z",
  "updated_at": "2026-07-31T08:00:24Z",
  "started_at": "2026-07-31T08:00:01Z",
  "completed_at": "2026-07-31T08:00:24Z",
  "session_dir": "/tmp/traffictracer/sessions/20260731-example",
  "target": {
    "url": "https://example.com/",
    "domain": "example.com"
  },
  "component_versions": {
    "traffictracer": {
      "version": "0.1.0-dev",
      "commit": "468b7479e658644952743e774cd443131db8c0b1"
    },
    "mihomo": {
      "version": "1.19.14-traffictracer",
      "commit": "c24743d9259615c8420582714d1daee493ca58e8"
    },
    "clash_verge_rev": {
      "version": "2.4.4-traffictracer",
      "commit": "5f5845c1a8a440619e2a4d84eb08ed9e60c7dbfd"
    },
    "worker_api": 1
  },
  "artifacts": [
    {
      "name": "correlation",
      "kind": "derived",
      "path": "analysis/correlation.json",
      "media_type": "application/json",
      "size_bytes": 8742,
      "sha256": "49c7f95dbdf2e07a52015f67955335890b8c4c3ab489608084874e5f27dc747f",
      "created_at": "2026-07-31T08:00:23Z"
    }
  ],
  "warnings": []
}
